{
  "$schema": "https://json-schema.org/draft/2020-12/schema",
  "$id": "https://football-edge.invalid/contract/snapshot.schema.json",
  "title": "football-edge site anlık görüntüsü v1",
  "description": "Faz 6 İz B tasarımı §5.2. Sayılar görüntü hassasiyetindedir (§5.4): olasılık ve hareket yüzde puanı 1 ondalık, CLV yüzde 2 ondalık, fiyat 2 ondalık. Diziler adı geçen anahtarla artan sıralıdır. content_sha256 = generated_at, git_sha ve kendisi hariç gövdenin kanonik JSON'unun (sort_keys, ayırıcılar ',' ':', ensure_ascii=false) sha256'sı.",
  "type": "object",
  "additionalProperties": false,
  "required": ["schema_version", "generated_at", "git_sha", "content_sha256", "ledger", "floor", "leagues", "teams", "matches", "record", "value_badge", "analysis"],
  "properties": {
    "schema_version": {"const": 1},
    "generated_at": {"$ref": "#/$defs/instant"},
    "git_sha": {"type": "string", "pattern": "^[0-9a-f]{40}$"},
    "content_sha256": {"$ref": "#/$defs/sha256"},
    "ledger": {
      "type": "object",
      "additionalProperties": false,
      "required": ["rows", "last_id", "head", "anchor"],
      "properties": {
        "rows": {"$ref": "#/$defs/count"},
        "last_id": {"$ref": "#/$defs/count"},
        "head": {"$ref": "#/$defs/sha256"},
        "anchor": {
          "type": "object",
          "additionalProperties": false,
          "required": ["file", "rows", "last_id", "head"],
          "properties": {
            "file": {"type": "string", "pattern": "^head-[0-9]{4}-[0-9]{2}-[0-9]{2}\\.txt$"},
            "rows": {"$ref": "#/$defs/count"},
            "last_id": {"$ref": "#/$defs/count"},
            "head": {"$ref": "#/$defs/sha256"}
          }
        }
      }
    },
    "floor": {"const": "2026-07-02T00:00:00Z"},
    "leagues": {
      "description": "Sıra: id.",
      "type": "array",
      "items": {
        "type": "object",
        "additionalProperties": false,
        "required": ["id", "slug", "name", "country", "matches", "move_distribution"],
        "properties": {
          "id": {"$ref": "#/$defs/league_id"},
          "slug": {"$ref": "#/$defs/slug"},
          "name": {"$ref": "#/$defs/label"},
          "country": {"$ref": "#/$defs/label"},
          "matches": {"$ref": "#/$defs/count"},
          "move_distribution": {
            "description": "Mühürlü, en az iki turlu maçlarda |açılış→kapanış| hareketinin en büyük bileşeni, yüzde puanı; maç < 5 ise null.",
            "type": ["object", "null"],
            "additionalProperties": false,
            "required": ["p10", "p50", "p90"],
            "properties": {
              "p10": {"$ref": "#/$defs/points"},
              "p50": {"$ref": "#/$defs/points"},
              "p90": {"$ref": "#/$defs/points"}
            }
          }
        }
      }
    },
    "teams": {
      "description": "Sıra: (league_id, slug).",
      "type": "array",
      "items": {
        "type": "object",
        "additionalProperties": false,
        "required": ["league_id", "slug", "name", "matches", "indexable"],
        "properties": {
          "league_id": {"$ref": "#/$defs/league_id"},
          "slug": {"$ref": "#/$defs/slug"},
          "name": {"$ref": "#/$defs/label"},
          "matches": {"$ref": "#/$defs/count"},
          "indexable": {"type": "boolean"}
        }
      }
    },
    "matches": {
      "description": "Sıra: (commence_time, id).",
      "type": "array",
      "items": {
        "type": "object",
        "additionalProperties": false,
        "required": ["id", "league_id", "path_id", "slug", "date", "commence_time", "home", "away", "referee", "sealed", "rounds", "h2h", "move", "indexable"],
        "properties": {
          "id": {"type": "string", "pattern": "^[0-9a-z]{12,64}$"},
          "league_id": {"$ref": "#/$defs/league_id"},
          "path_id": {"type": "string", "pattern": "^[0-9a-z]{12}$"},
          "slug": {"type": "string", "pattern": "^[a-z0-9]+(-[a-z0-9]+)*-vs-[a-z0-9]+(-[a-z0-9]+)*$", "maxLength": 170},
          "date": {"type": "string", "pattern": "^[0-9]{4}-[0-9]{2}-[0-9]{2}$"},
          "commence_time": {"$ref": "#/$defs/instant"},
          "home": {"$ref": "#/$defs/label"},
          "away": {"$ref": "#/$defs/label"},
          "referee": {"$ref": "#/$defs/person"},
          "sealed": {"type": "boolean"},
          "rounds": {"$ref": "#/$defs/count"},
          "h2h": {
            "type": "object",
            "additionalProperties": false,
            "required": ["opening", "latest", "closing"],
            "properties": {
              "opening": {"$ref": "#/$defs/round"},
              "latest": {"$ref": "#/$defs/round"},
              "closing": {"$ref": "#/$defs/round"}
            }
          },
          "move": {
            "description": "Açılış→kapanış (mühürsüzse son), yüzde puanı; iki uç da görünür değilse null.",
            "type": ["object", "null"],
            "additionalProperties": false,
            "required": ["home", "draw", "away"],
            "properties": {
              "home": {"$ref": "#/$defs/points"},
              "draw": {"$ref": "#/$defs/points"},
              "away": {"$ref": "#/$defs/points"}
            }
          },
          "indexable": {"type": "boolean"}
        }
      }
    },
    "record": {
      "type": "object",
      "additionalProperties": false,
      "required": ["published", "entries", "summary"],
      "properties": {
        "published": {"$ref": "#/$defs/count"},
        "entries": {
          "description": "Sıra: publication_id. site.record kolonları (B5).",
          "type": "array",
          "items": {
            "type": "object",
            "additionalProperties": false,
            "required": ["publication_id", "match_id", "market", "outcome", "published_at", "published_price", "publication_ledger_id", "closing_fair_price", "clv", "publication_hash"],
            "properties": {
              "publication_id": {"$ref": "#/$defs/count"},
              "match_id": {"type": "string", "pattern": "^[0-9a-z]{12,64}$"},
              "market": {"enum": ["h2h"]},
              "outcome": {"enum": ["home", "draw", "away"]},
              "published_at": {"$ref": "#/$defs/instant"},
              "published_price": {"$ref": "#/$defs/price"},
              "publication_ledger_id": {"$ref": "#/$defs/count"},
              "closing_fair_price": {"$ref": "#/$defs/price"},
              "clv": {"$ref": "#/$defs/percent2"},
              "publication_hash": {"$ref": "#/$defs/sha256"}
            }
          }
        },
        "summary": {
          "description": "n = 0 iken null.",
          "type": ["object", "null"],
          "additionalProperties": false,
          "required": ["mean_clv", "ci_low", "ci_high", "n"],
          "properties": {
            "mean_clv": {"$ref": "#/$defs/percent2"},
            "ci_low": {"$ref": "#/$defs/percent2"},
            "ci_high": {"$ref": "#/$defs/percent2"},
            "n": {"type": "integer", "minimum": 1}
          }
        }
      }
    },
    "value_badge": {"description": "Faz 5 şema sürümünü artırır (B6).", "const": null},
    "analysis": {"description": "Faz 7 şema sürümünü artırır (B6).", "const": null}
  },
  "$defs": {
    "instant": {"type": "string", "pattern": "^[0-9]{4}-[0-9]{2}-[0-9]{2}T[0-9]{2}:[0-9]{2}:[0-9]{2}Z$"},
    "sha256": {"type": "string", "pattern": "^[0-9a-f]{64}$"},
    "count": {"type": "integer", "minimum": 0},
    "league_id": {"type": "string", "pattern": "^[a-z0-9]+(\\.[a-z0-9]+)*$", "maxLength": 20},
    "slug": {"type": "string", "pattern": "^[a-z0-9]+(-[a-z0-9]+)*$", "maxLength": 80},
    "label": {"description": "Serbest metin yalnız takım, lig ve ülke adıdır (H2b).", "type": "string", "minLength": 1, "maxLength": 80},
    "person": {"description": "Süper Lig maçında TFF'nin maç başlamadan önce açıkladığı baş hakem adı; yoksa null (H2b genişlemesi, docs/superpowers/specs/2026-10-02-tff-hakem-site-design.md §6).", "type": ["string", "null"], "minLength": 1, "maxLength": 80},
    "points": {"description": "Yüzde puanı, 1 ondalık.", "type": "number", "minimum": -100, "maximum": 100},
    "percent": {"description": "Yüzde, 1 ondalık.", "type": "number", "minimum": 0, "maximum": 100},
    "percent2": {"description": "Yüzde, 2 ondalık.", "type": "number", "minimum": -100, "maximum": 10000},
    "price": {"description": "Ondalık oran, 2 ondalık.", "type": "number", "minimum": 1},
    "round": {
      "description": "Konsensüs turu; tam kitap sayısı 3'ün altındaysa null.",
      "type": ["object", "null"],
      "additionalProperties": false,
      "required": ["observed_at", "books", "p"],
      "properties": {
        "observed_at": {"$ref": "#/$defs/instant"},
        "books": {"type": "integer", "minimum": 3},
        "p": {
          "type": "object",
          "additionalProperties": false,
          "required": ["home", "draw", "away"],
          "properties": {
            "home": {"$ref": "#/$defs/percent"},
            "draw": {"$ref": "#/$defs/percent"},
            "away": {"$ref": "#/$defs/percent"}
          }
        }
      }
    }
  }
}
