{
  "analysis": null,
  "content_sha256": "69dfb8c73ebb47dcc5bc381ae3bd080a1616ac21dc2da94cfe6b2aa56c9f56dc",
  "floor": "2026-07-02T00:00:00Z",
  "generated_at": "2026-09-24T12:00:00Z",
  "git_sha": "0000000000000000000000000000000000000000",
  "leagues": [
    {"country": "Nordland", "id": "tst.1", "matches": 5, "move_distribution": {"p10": 1.3, "p50": 3.1, "p90": 4.6}, "name": "Kuzey Ligi", "slug": "kuzey-ligi"},
    {"country": "Südland", "id": "tst.2", "matches": 3, "move_distribution": null, "name": "Güney Kupası", "slug": "guney-kupasi"}
  ],
  "ledger": {"anchor": {"file": "head-2026-09-23.txt", "head": "bbbbbbbbbbbbbbbbbbbbbbbbbbbbbbbbbbbbbbbbbbbbbbbbbbbbbbbbbbbbbbbb", "last_id": 128, "rows": 126}, "head": "aaaaaaaaaaaaaaaaaaaaaaaaaaaaaaaaaaaaaaaaaaaaaaaaaaaaaaaaaaaaaaaa", "last_id": 137, "rows": 135},
  "matches": [
    {"away": "Beta FK", "commence_time": "2026-09-20T17:00:00Z", "date": "2026-09-20", "h2h": {"closing": {"books": 3, "observed_at": "2026-09-20T16:00:00Z", "p": {"away": 23.2, "draw": 27.0, "home": 49.8}}, "latest": {"books": 3, "observed_at": "2026-09-20T16:00:00Z", "p": {"away": 23.2, "draw": 27.0, "home": 49.8}}, "opening": {"books": 3, "observed_at": "2026-09-19T00:00:00Z", "p": {"away": 26.0, "draw": 27.9, "home": 46.1}}}, "home": "Alfa Spor", "id": "1a10c0ffee0000000000000000000000", "indexable": true, "league_id": "tst.1", "move": {"away": -2.8, "draw": -0.9, "home": 3.7}, "path_id": "1a10c0ffee00", "referee": "Deneme Hakem", "rounds": 2, "sealed": true, "slug": "alfa-spor-vs-beta-fk"},
    {"away": "Alfa Spor", "commence_time": "2026-09-21T17:00:00Z", "date": "2026-09-21", "h2h": {"closing": {"books": 3, "observed_at": "2026-09-21T16:00:00Z", "p": {"away": 36.7, "draw": 29.0, "home": 34.3}}, "latest": {"books": 3, "observed_at": "2026-09-21T16:00:00Z", "p": {"away": 36.7, "draw": 29.0, "home": 34.3}}, "opening": {"books": 3, "observed_at": "2026-09-19T01:00:00Z", "p": {"away": 34.0, "draw": 28.9, "home": 37.1}}}, "home": "Gamma United", "id": "2a20c0ffee1000000000000000000000", "indexable": true, "league_id": "tst.1", "move": {"away": 2.8, "draw": 0.0, "home": -2.8}, "path_id": "2a20c0ffee10", "referee": null, "rounds": 2, "sealed": true, "slug": "gamma-united-vs-alfa-spor"},
    {"away": "Delta Şehir", "commence_time": "2026-09-22T17:00:00Z", "date": "2026-09-22", "h2h": {"closing": {"books": 3, "observed_at": "2026-09-22T16:00:00Z", "p": {"away": 19.6, "draw": 26.2, "home": 54.2}}, "latest": {"books": 3, "observed_at": "2026-09-22T16:00:00Z", "p": {"away": 19.6, "draw": 26.2, "home": 54.2}}, "opening": {"books": 3, "observed_at": "2026-09-19T02:00:00Z", "p": {"away": 22.0, "draw": 26.9, "home": 51.1}}}, "home": "Beta FK", "id": "3a30c0ffee2000000000000000000000", "indexable": true, "league_id": "tst.1", "move": {"away": -2.4, "draw": -0.7, "home": 3.1}, "path_id": "3a30c0ffee20", "referee": null, "rounds": 2, "sealed": true, "slug": "beta-fk-vs-delta-sehir"},
    {"away": "Gamma United", "commence_time": "2026-09-23T17:00:00Z", "date": "2026-09-23", "h2h": {"closing": {"books": 3, "observed_at": "2026-09-23T16:00:00Z", "p": {"away": 31.2, "draw": 29.0, "home": 39.9}}, "latest": {"books": 3, "observed_at": "2026-09-23T16:00:00Z", "p": {"away": 31.2, "draw": 29.0, "home": 39.9}}, "opening": {"books": 3, "observed_at": "2026-09-19T03:00:00Z", "p": {"away": 31.0, "draw": 29.3, "home": 39.7}}}, "home": "Delta Şehir", "id": "4a40c0ffee3000000000000000000000", "indexable": true, "league_id": "tst.1", "move": {"away": 0.2, "draw": -0.3, "home": 0.2}, "path_id": "4a40c0ffee30", "referee": null, "rounds": 2, "sealed": true, "slug": "delta-sehir-vs-gamma-united"},
    {"away": "Delta Şehir", "commence_time": "2026-09-24T17:00:00Z", "date": "2026-09-24", "h2h": {"closing": {"books": 3, "observed_at": "2026-09-24T16:00:00Z", "p": {"away": 16.2, "draw": 22.9, "home": 60.9}}, "latest": {"books": 3, "observed_at": "2026-09-24T16:00:00Z", "p": {"away": 16.2, "draw": 22.9, "home": 60.9}}, "opening": {"books": 3, "observed_at": "2026-09-19T04:00:00Z", "p": {"away": 19.8, "draw": 24.5, "home": 55.6}}}, "home": "Alfa Spor", "id": "5a50c0ffee4000000000000000000000", "indexable": true, "league_id": "tst.1", "move": {"away": -3.7, "draw": -1.6, "home": 5.3}, "path_id": "5a50c0ffee40", "referee": null, "rounds": 2, "sealed": true, "slug": "alfa-spor-vs-delta-sehir"},
    {"away": "Zeta Rovers", "commence_time": "2026-09-27T18:30:00Z", "date": "2026-09-27", "h2h": {"closing": null, "latest": {"books": 3, "observed_at": "2026-09-23T09:00:00Z", "p": {"away": 28.4, "draw": 29.7, "home": 41.9}}, "opening": {"books": 3, "observed_at": "2026-09-21T09:00:00Z", "p": {"away": 31.3, "draw": 30.5, "home": 38.2}}}, "home": "Epsilon Athletic", "id": "b2c0ffee000000000000000000000001", "indexable": true, "league_id": "tst.2", "move": {"away": -2.8, "draw": -0.8, "home": 3.7}, "path_id": "b2c0ffee0000", "referee": null, "rounds": 2, "sealed": false, "slug": "epsilon-athletic-vs-zeta-rovers"},
    {"away": "Eta Kent", "commence_time": "2026-09-28T15:00:00Z", "date": "2026-09-28", "h2h": {"closing": null, "latest": {"books": 3, "observed_at": "2026-09-23T10:00:00Z", "p": {"away": 23.8, "draw": 27.8, "home": 48.5}}, "opening": {"books": 3, "observed_at": "2026-09-23T10:00:00Z", "p": {"away": 23.8, "draw": 27.8, "home": 48.5}}}, "home": "Zeta Rovers", "id": "b3c0ffee000000000000000000000002", "indexable": false, "league_id": "tst.2", "move": {"away": 0.0, "draw": 0.0, "home": 0.0}, "path_id": "b3c0ffee0000", "referee": null, "rounds": 1, "sealed": false, "slug": "zeta-rovers-vs-eta-kent"},
    {"away": "Epsilon Athletic", "commence_time": "2026-09-29T19:00:00Z", "date": "2026-09-29", "h2h": {"closing": null, "latest": {"books": 3, "observed_at": "2026-09-23T11:00:00Z", "p": {"away": 28.4, "draw": 28.7, "home": 42.9}}, "opening": null}, "home": "Eta Kent", "id": "b4c0ffee000000000000000000000003", "indexable": true, "league_id": "tst.2", "move": null, "path_id": "b4c0ffee0000", "referee": null, "rounds": 2, "sealed": false, "slug": "eta-kent-vs-epsilon-athletic"}
  ],
  "record": {"entries": [], "published": 0, "summary": null},
  "schema_version": 1,
  "teams": [
    {"indexable": true, "league_id": "tst.1", "matches": 3, "name": "Alfa Spor", "slug": "alfa-spor"},
    {"indexable": false, "league_id": "tst.1", "matches": 2, "name": "Beta FK", "slug": "beta-fk"},
    {"indexable": true, "league_id": "tst.1", "matches": 3, "name": "Delta Şehir", "slug": "delta-sehir"},
    {"indexable": false, "league_id": "tst.1", "matches": 2, "name": "Gamma United", "slug": "gamma-united"},
    {"indexable": false, "league_id": "tst.2", "matches": 2, "name": "Epsilon Athletic", "slug": "epsilon-athletic"},
    {"indexable": false, "league_id": "tst.2", "matches": 2, "name": "Eta Kent", "slug": "eta-kent"},
    {"indexable": false, "league_id": "tst.2", "matches": 2, "name": "Zeta Rovers", "slug": "zeta-rovers"}
  ],
  "value_badge": null
}
